{
  "schema": "pokemon-native-differential-case-v1",
  "id": "solar-beam-sand-half",
  "provenance": {
    "kind": "showdown-derived",
    "source_file": "data/moves.ts; data/conditions.ts; sim/battle-actions.ts",
    "test_name": "solar-beam-sand-half",
    "oracle_revision": "6e71625b9e6cffeda268b548ae7f43a7643fc3f0"
  },
  "format": "gen3ou",
  "seed": [
    1,
    2,
    3,
    4
  ],
  "teams": [
    {
      "source": "solar-beam-sand-half-p1.txt",
      "normalized": [
        {
          "species": "smeargle",
          "level": 100,
          "gender": "M",
          "ability": "owntempo",
          "item": "",
          "moves": [
            "solarbeam"
          ],
          "stats": [
            251,
            76,
            106,
            76,
            126,
            186
          ],
          "status": null
        }
      ]
    },
    {
      "source": "solar-beam-sand-half-p2.txt",
      "normalized": [
        {
          "species": "blissey",
          "level": 100,
          "gender": "M",
          "ability": "naturalcure",
          "item": "",
          "moves": [
            "sandstorm",
            "splash"
          ],
          "stats": [
            651,
            56,
            56,
            186,
            306,
            146
          ],
          "status": null
        }
      ]
    }
  ],
  "source_choices": [
    [
      "move 1",
      "move 1"
    ],
    [
      "move 1",
      "move 2"
    ]
  ],
  "choices": [
    [
      "move 1",
      "move 1"
    ],
    [
      "move 1",
      "move 2"
    ]
  ],
  "forced_outcomes": [],
  "features": [
    "choice.move",
    "state.canonical",
    "condition.weather"
  ],
  "boundaries": [
    "request",
    "choice",
    "queue",
    "handlers",
    "state",
    "events",
    "prng"
  ],
  "limits": {
    "max_boundaries": 3,
    "max_actions": 4
  }
}
