{
  "schema": "pokemon-native-differential-case-v1",
  "id": "drag-ingrain-block",
  "provenance": {
    "kind": "showdown-derived",
    "source_file": "sim/battle-actions.ts; sim/battle.ts; data/moves.ts; data/abilities.ts",
    "test_name": "Ingrain installs a volatile DragOut cancellation handler",
    "oracle_revision": "6e71625b9e6cffeda268b548ae7f43a7643fc3f0"
  },
  "format": "gen3ou",
  "seed": [
    161,
    162,
    163,
    164
  ],
  "teams": [
    {
      "source": "drag-ingrain-block-p1.txt",
      "normalized": [
        {
          "species": "smeargle",
          "level": 100,
          "gender": "M",
          "ability": "owntempo",
          "item": "",
          "moves": [
            "splash",
            "roar"
          ],
          "stats": [
            251,
            76,
            106,
            76,
            126,
            186
          ],
          "status": null
        }
      ]
    },
    {
      "source": "drag-ingrain-block-p2.txt",
      "normalized": [
        {
          "species": "roselia",
          "level": 100,
          "gender": "M",
          "ability": "naturalcure",
          "item": "",
          "moves": [
            "ingrain",
            "gigadrain"
          ],
          "stats": [
            241,
            156,
            126,
            236,
            196,
            166
          ],
          "status": null
        },
        {
          "species": "magikarp",
          "level": 100,
          "gender": "M",
          "ability": "swiftswim",
          "item": "",
          "moves": [
            "splash"
          ],
          "stats": [
            181,
            56,
            146,
            66,
            76,
            196
          ],
          "status": null
        }
      ]
    }
  ],
  "source_choices": [
    [
      "move 1",
      "move 1"
    ],
    [
      "move 2",
      "move 2"
    ]
  ],
  "choices": [
    [
      "move 1",
      "move 1"
    ],
    [
      "move 2",
      "move 2"
    ]
  ],
  "forced_outcomes": [],
  "features": [
    "choice.move",
    "condition.volatile",
    "prng.labeled",
    "queue.move-priority",
    "state.canonical"
  ],
  "boundaries": [
    "choice",
    "events",
    "handlers",
    "prng",
    "queue",
    "request",
    "state"
  ],
  "limits": {
    "max_boundaries": 3,
    "max_actions": 4
  }
}
