{
  "schema":"pokemon-native-differential-case-v1",
  "id":"snatch-pressure-howl",
  "provenance":{"kind":"showdown-derived","source_file":"data/mods/gen4/moves.ts","test_name":"Checkpoint 6: successful Snatch against Pressure charges the Snatch slot once more","oracle_revision":"6e71625b9e6cffeda268b548ae7f43a7643fc3f0"},
  "format":"gen3ou",
  "seed":[1,2,3,4],
  "teams":[
    {"source":"alakazam-snatch-p1.txt","normalized":[{"species":"alakazam","level":100,"gender":"M","ability":"synchronize","item":"","moves":["snatch"],"stats":[251,136,126,306,206,276],"status":null}]},
    {"source":"dusclops-howl-pressure-p2.txt","normalized":[{"species":"dusclops","level":100,"gender":"M","ability":"pressure","item":"","moves":["howl"],"stats":[221,176,296,156,296,86],"status":null}]}
  ],
  "source_choices":[["move 1","move 1"]],
  "choices":[["move 1","move 1"]],
  "forced_outcomes":[],
  "features":["move.snatch","volatile.snatch","handler.prepare-hit","move.called-entry","effect.boost","state.canonical"],
  "boundaries":["request","choice","queue","handlers","state","events","prng"],
  "limits":{"max_boundaries":2,"max_actions":2}
}
