{
  "schema": "pokemon-native-differential-case-v1",
  "id": "boost-accuracy-sweet-scent-at",
  "provenance": {
    "kind": "showdown-derived",
    "source_file": "sim/battle-actions.ts",
    "test_name": "sweet-scent post-boost accuracy at threshold",
    "oracle_revision": "6e71625b9e6cffeda268b548ae7f43a7643fc3f0"
  },
  "format": "gen3ou",
  "seed": [
    17,
    31,
    47,
    3
  ],
  "teams": [
    {
      "source": "persian-sweet-scent-flash-p1.txt",
      "normalized": [
        {
          "species": "persian",
          "level": 100,
          "gender": "M",
          "ability": "limber",
          "item": "",
          "moves": [
            "sweetscent",
            "flash"
          ],
          "stats": [
            271,
            176,
            156,
            166,
            166,
            266
          ],
          "status": null
        }
      ]
    },
    {
      "source": "magikarp-splash-p2.txt",
      "normalized": [
        {
          "species": "magikarp",
          "level": 100,
          "gender": "M",
          "ability": "swiftswim",
          "item": "",
          "moves": [
            "splash"
          ],
          "stats": [
            181,
            56,
            146,
            66,
            76,
            196
          ],
          "status": null
        }
      ]
    }
  ],
  "source_choices": [
    [
      "move 1",
      "move 1"
    ],
    [
      "move 2",
      "move 1"
    ]
  ],
  "choices": [
    [
      "move 1",
      "move 1"
    ],
    [
      "move 2",
      "move 1"
    ]
  ],
  "forced_outcomes": [
    {
      "label": "move.accuracy",
      "occurrence": 1,
      "range": 100,
      "result": 5
    },
    {
      "label": "move.accuracy",
      "occurrence": 2,
      "range": 100,
      "result": 93
    }
  ],
  "features": [
    "effect.boost",
    "hit.accuracy",
    "prng.labeled",
    "state.canonical"
  ],
  "boundaries": [
    "request",
    "choice",
    "queue",
    "state",
    "events",
    "prng"
  ],
  "limits": {
    "max_boundaries": 3,
    "max_actions": 4
  }
}
