{
  "schema": "pokemon-native-differential-case-v1",
  "id": "stat-item-deep-sea-tooth-guard",
  "provenance": {
    "kind": "showdown-derived",
    "source_file": "data/items.ts; data/mods/gen3/items.ts; sim/battle.ts",
    "test_name": "stat-item-deep-sea-tooth-guard",
    "oracle_revision": "6e71625b9e6cffeda268b548ae7f43a7643fc3f0"
  },
  "format": "gen3ou",
  "seed": [
    1,
    2,
    3,
    4
  ],
  "teams": [
    {
      "source": "stat-item-deep-sea-tooth-guard-p1.txt",
      "normalized": [
        {
          "species": "vaporeon",
          "level": 100,
          "gender": "F",
          "ability": "waterabsorb",
          "item": "deepseatooth",
          "moves": [
            "surf"
          ],
          "stats": [
            401,
            166,
            156,
            256,
            226,
            166
          ],
          "status": null
        }
      ]
    },
    {
      "source": "stat-item-deep-sea-tooth-guard-p2.txt",
      "normalized": [
        {
          "species": "blissey",
          "level": 100,
          "gender": "F",
          "ability": "naturalcure",
          "item": "",
          "moves": [
            "splash"
          ],
          "stats": [
            651,
            56,
            56,
            186,
            306,
            146
          ],
          "status": null
        }
      ]
    }
  ],
  "source_choices": [
    [
      "move 1",
      "move 1"
    ]
  ],
  "choices": [
    [
      "move 1",
      "move 1"
    ]
  ],
  "forced_outcomes": [],
  "features": [
    "choice.move",
    "damage.gen3",
    "queue.speed",
    "prng.labeled",
    "state.canonical",
    "item.deep-sea-tooth",
    "handler.species-guard"
  ],
  "boundaries": [
    "request",
    "choice",
    "queue",
    "handlers",
    "state",
    "events",
    "prng"
  ],
  "limits": {
    "max_boundaries": 2,
    "max_actions": 2
  }
}
