{
  "schema": "pokemon-native-differential-case-v1",
  "id": "passive-item-luxuryball",
  "provenance": {
    "kind": "showdown-derived",
    "source_file": "data/items.ts; data/mods/gen3/items.ts; data/moves.ts; sim/battle-actions.ts",
    "test_name": "Luxury Ball is a callback-free identity moved by generic Trick",
    "oracle_revision": "6e71625b9e6cffeda268b548ae7f43a7643fc3f0"
  },
  "format": "gen3ou",
  "seed": [
    1,
    2,
    3,
    4
  ],
  "teams": [
    {
      "source": "passive-item-luxuryball-p1.txt",
      "normalized": [
        {
          "species": "alakazam",
          "level": 100,
          "gender": "M",
          "ability": "synchronize",
          "item": "luxuryball",
          "moves": [
            "trick",
            "psychic"
          ],
          "stats": [
            251,
            136,
            126,
            306,
            206,
            276
          ],
          "status": null
        }
      ]
    },
    {
      "source": "passive-item-luxuryball-p2.txt",
      "normalized": [
        {
          "species": "magikarp",
          "level": 100,
          "gender": "M",
          "ability": "swiftswim",
          "item": "oranberry",
          "moves": [
            "splash"
          ],
          "stats": [
            181,
            56,
            146,
            66,
            76,
            196
          ],
          "status": null
        }
      ]
    }
  ],
  "source_choices": [
    [
      "move 1",
      "move 1"
    ]
  ],
  "choices": [
    [
      "move 1",
      "move 1"
    ]
  ],
  "forced_outcomes": [],
  "features": [
    "choice.move",
    "item.passive-identity",
    "item.set",
    "item.swap",
    "item.take",
    "state.canonical"
  ],
  "boundaries": [
    "request",
    "choice",
    "queue",
    "handlers",
    "state",
    "events",
    "prng"
  ],
  "limits": {
    "max_boundaries": 2,
    "max_actions": 2
  }
}
