{
  "schema": "pokemon-native-differential-case-v1",
  "id": "secondary-mistball",
  "provenance": {
    "kind": "showdown-derived",
    "source_file": "data/moves.ts",
    "test_name": "Generated single-effect damaging secondary: Mist Ball",
    "oracle_revision": "6e71625b9e6cffeda268b548ae7f43a7643fc3f0"
  },
  "format": "gen3ou",
  "seed": [
    313,
    197,
    83,
    44
  ],
  "teams": [
    {
      "source": "secondary-mistball-p1.txt",
      "normalized": [
        {
          "species": "smeargle",
          "level": 100,
          "gender": "M",
          "ability": "owntempo",
          "item": "",
          "moves": [
            "mistball"
          ],
          "stats": [
            251,
            76,
            106,
            76,
            126,
            186
          ],
          "status": null
        }
      ]
    },
    {
      "source": "secondary-mistball-p2.txt",
      "normalized": [
        {
          "species": "blissey",
          "level": 100,
          "gender": "F",
          "ability": "naturalcure",
          "item": "",
          "moves": [
            "splash"
          ],
          "stats": [
            651,
            56,
            56,
            186,
            306,
            146
          ],
          "status": null
        }
      ]
    }
  ],
  "source_choices": [
    [
      "move 1",
      "move 1"
    ]
  ],
  "choices": [
    [
      "move 1",
      "move 1"
    ]
  ],
  "forced_outcomes": [],
  "features": [
    "choice.move",
    "damage.gen3",
    "effect.boost",
    "effect.secondary",
    "hit.accuracy",
    "prng.labeled",
    "prng.secondary",
    "state.canonical"
  ],
  "boundaries": [
    "request",
    "choice",
    "queue",
    "handlers",
    "immunity",
    "state",
    "events",
    "prng"
  ],
  "limits": {
    "max_boundaries": 2,
    "max_actions": 2
  }
}
