{"schema":"pokemon-native-differential-case-v1","id":"berry-pinch-clear-body-positive","provenance":{"kind":"showdown-derived","source_file":"data/mods/gen3/items.ts","test_name":"Liechi positive self boost passes Clear Body TryBoost","oracle_revision":"6e71625b9e6cffeda268b548ae7f43a7643fc3f0"},"format":"gen3ou","seed":[83,7,23,49],"teams":[{"source":"metagross-liechi-splash-p1.txt","normalized":[{"species":"metagross","level":90,"gender":"N","ability":"clearbody","item":"liechiberry","moves":["splash"],"stats":[271,275,266,203,194,158],"status":null,"initial_hp":67}]},{"source":"magikarp-splash-p2.txt","normalized":[{"species":"magikarp","level":100,"gender":"M","ability":"swiftswim","item":"","moves":["splash"],"stats":[181,56,146,66,76,196],"status":null}]}],"source_choices":[["move 1","move 1"]],"choices":[["move 1","move 1"]],"forced_outcomes":[],"features":["effect.boost","handler.try-boost","handler.residual","item.consumption","state.canonical"],"boundaries":["request","choice","queue","handlers","state","events","prng"],"limits":{"max_boundaries":2,"max_actions":2}}
