{"schema":"pokemon-native-differential-case-v1","id":"pressure-immunity","provenance":{"kind":"showdown-derived","source_file":"data/mods/gen3/scripts.ts; data/mods/gen4/abilities.ts","test_name":"Pressure deduction precedes natural type immunity","oracle_revision":"6e71625b9e6cffeda268b548ae7f43a7643fc3f0"},"format":"gen3ou","seed":[1,2,3,4],"teams":[{"source":"marowak-earthquake-p1.txt","normalized":[{"species":"marowak","level":100,"gender":"M","ability":"rockhead","item":"","moves":["earthquake"],"stats":[261,196,256,136,196,126],"status":null}]},{"source":"articuno-pressure-splash-p2.txt","normalized":[{"species":"articuno","level":100,"gender":"N","ability":"pressure","item":"","moves":["splash"],"stats":[321,206,236,226,286,206],"status":null}]}],"source_choices":[["move 1","move 1"]],"choices":[["move 1","move 1"]],"forced_outcomes":[],"features":["ability.pressure","handler.deduct-pp","hit.type-immunity","state.canonical"],"boundaries":["request","choice","queue","handlers","immunity","state","events","prng"],"limits":{"max_boundaries":2,"max_actions":2}}
