{"schema":"pokemon-native-differential-case-v1","id":"berry-sitrus-rain-dish-order","provenance":{"kind":"showdown-derived","source_file":"sim/battle.ts","test_name":"Rain Dish subOrder 3 heals before Sitrus Berry subOrder 4","oracle_revision":"6e71625b9e6cffeda268b548ae7f43a7643fc3f0"},"format":"gen3ou","seed":[1,2,3,4],"teams":[{"source":"vaporeon-rain-dish-sitrus-p1.txt","normalized":[{"species":"vaporeon","level":100,"gender":"M","ability":"raindish","item":"sitrusberry","moves":["raindance","splash"],"stats":[401,166,156,256,226,166],"status":null,"initial_hp":175}]},{"source":"magikarp-splash-p2.txt","normalized":[{"species":"magikarp","level":100,"gender":"M","ability":"swiftswim","item":"","moves":["splash"],"stats":[181,56,146,66,76,196],"status":null}]}],"source_choices":[["move 1","move 1"]],"choices":[["move 1","move 1"]],"forced_outcomes":[],"features":["handler.residual","item.consumption","weather.rain","weather.residual-heal","state.canonical"],"boundaries":["request","choice","queue","handlers","state","events","prng"],"limits":{"max_boundaries":2,"max_actions":2}}
