{
  "schema": "pokemon-native-differential-case-v1",
  "id": "jump-kick-dig",
  "provenance": {
    "kind": "showdown-derived",
    "source_file": "data/mods/gen3/moves.ts#jumpkick,highjumpkick; sim/battle-actions.ts#tryMoveHit",
    "test_name": "underground target failure invokes HJK crash damage",
    "oracle_revision": "6e71625b9e6cffeda268b548ae7f43a7643fc3f0"
  },
  "format": "gen3ou",
  "seed": [
    1,
    2,
    3,
    4
  ],
  "teams": [
    {
      "source": "jump-kick-dig-p1.txt",
      "normalized": [
        {
          "species": "smeargle",
          "level": 100,
          "gender": "M",
          "ability": "owntempo",
          "item": "",
          "moves": [
            "highjumpkick"
          ],
          "stats": [
            251,
            76,
            106,
            76,
            126,
            186
          ],
          "status": null
        }
      ]
    },
    {
      "source": "jump-kick-dig-p2.txt",
      "normalized": [
        {
          "species": "persian",
          "level": 100,
          "gender": "M",
          "ability": "limber",
          "item": "",
          "moves": [
            "dig"
          ],
          "stats": [
            271,
            176,
            156,
            166,
            166,
            266
          ],
          "status": null
        }
      ]
    }
  ],
  "source_choices": [
    [
      "move 1",
      "move 1"
    ]
  ],
  "choices": [
    [
      "move 1",
      "move 1"
    ]
  ],
  "forced_outcomes": [],
  "features": [
    "choice.move",
    "effect.crash-damage",
    "handler.move-fail",
    "handler.try-hit",
    "hit.accuracy",
    "move.charge",
    "prng.labeled",
    "state.canonical"
  ],
  "boundaries": [
    "choice",
    "events",
    "handlers",
    "prng",
    "queue",
    "request",
    "state"
  ],
  "limits": {
    "max_boundaries": 2,
    "max_actions": 2
  }
}
