{
  "schema": "pokemon-native-differential-case-v1",
  "id": "retaliation-weather-ball-clear-mirror-coat",
  "provenance": {
    "kind": "showdown-derived",
    "source_file": "data/moves.ts; data/mods/gen3/moves.ts",
    "test_name": "Clear-weather Weather Ball is physical and does not feed Mirror Coat",
    "oracle_revision": "6e71625b9e6cffeda268b548ae7f43a7643fc3f0"
  },
  "format": "gen3ou",
  "seed": [
    65,
    66,
    67,
    68
  ],
  "teams": [
    {
      "source": "retaliation-weather-ball-clear-mirror-coat-p1.txt",
      "normalized": [
        {
          "species": "smeargle",
          "level": 100,
          "gender": "M",
          "ability": "owntempo",
          "item": "",
          "moves": [
            "weatherball"
          ],
          "stats": [
            251,
            76,
            106,
            76,
            126,
            186
          ],
          "status": null
        }
      ]
    },
    {
      "source": "retaliation-weather-ball-clear-mirror-coat-p2.txt",
      "normalized": [
        {
          "species": "smeargle",
          "level": 50,
          "gender": "M",
          "ability": "owntempo",
          "item": "",
          "moves": [
            "mirrorcoat"
          ],
          "stats": [
            130,
            40,
            55,
            40,
            65,
            95
          ],
          "status": null
        }
      ]
    }
  ],
  "source_choices": [
    [
      "move 1",
      "move 1"
    ]
  ],
  "choices": [
    [
      "move 1",
      "move 1"
    ]
  ],
  "forced_outcomes": [],
  "features": [
    "choice.move",
    "condition.volatile",
    "damage.fixed-literal",
    "handler.damage",
    "handler.try",
    "prng.labeled",
    "state.canonical"
  ],
  "boundaries": [
    "choice",
    "events",
    "prng",
    "queue",
    "request",
    "state"
  ],
  "limits": {
    "max_boundaries": 2,
    "max_actions": 2
  }
}
