{
  "schema": "pokemon-native-differential-case-v1",
  "id": "hidden-power-dark70-special-effective",
  "provenance": {
    "kind": "showdown-derived",
    "source_file": "sim/dex.ts; sim/pokemon.ts; data/mods/gen3/moves.ts",
    "test_name": "all-31 IVs construct 70-power Dark special Hidden Power and hit Psychic effectively",
    "oracle_revision": "6e71625b9e6cffeda268b548ae7f43a7643fc3f0"
  },
  "format": "gen3ou",
  "seed": [
    101,
    102,
    103,
    104
  ],
  "teams": [
    {
      "source": "hidden-power-dark70-special-effective-p1.txt",
      "normalized": [
        {
          "species": "smeargle",
          "level": 100,
          "gender": "M",
          "ability": "owntempo",
          "item": "",
          "moves": [
            "hiddenpower"
          ],
          "stats": [
            251,
            76,
            106,
            76,
            126,
            186
          ],
          "ivs": [
            31,
            31,
            31,
            31,
            31,
            31
          ],
          "status": null
        }
      ]
    },
    {
      "source": "hidden-power-dark70-special-effective-p2.txt",
      "normalized": [
        {
          "species": "slowpoke",
          "level": 100,
          "gender": "M",
          "ability": "owntempo",
          "item": "",
          "moves": [
            "calmmind"
          ],
          "stats": [
            321,
            166,
            166,
            116,
            116,
            66
          ],
          "ivs": [
            31,
            31,
            31,
            31,
            31,
            31
          ],
          "status": null
        }
      ]
    }
  ],
  "source_choices": [
    [
      "move 1",
      "move 1"
    ]
  ],
  "choices": [
    [
      "move 1",
      "move 1"
    ]
  ],
  "forced_outcomes": [],
  "features": [
    "choice.move",
    "damage.gen3",
    "damage.variable-power",
    "prng.labeled",
    "state.canonical"
  ],
  "boundaries": [
    "choice",
    "events",
    "handlers",
    "immunity",
    "prng",
    "queue",
    "request",
    "state"
  ],
  "limits": {
    "max_boundaries": 2,
    "max_actions": 2
  }
}
