{
  "schema": "pokemon-native-differential-case-v1",
  "id": "confusion-secondary-dynamicpunch-success",
  "provenance": {
    "kind": "showdown-derived",
    "source_file": "data/moves.ts; sim/battle-actions.ts; sim/battle.ts",
    "test_name": "Damaging confusion secondary: confusion-secondary-dynamicpunch-success",
    "oracle_revision": "6e71625b9e6cffeda268b548ae7f43a7643fc3f0"
  },
  "format": "gen3ou",
  "seed": [
    601,
    17,
    31,
    20
  ],
  "teams": [
    {
      "source": "confusion-secondary-dynamicpunch-success-p1.txt",
      "normalized": [
        {
          "species": "alakazam",
          "level": 100,
          "gender": "M",
          "ability": "synchronize",
          "item": "",
          "moves": [
            "dynamicpunch"
          ],
          "stats": [
            251,
            136,
            126,
            306,
            206,
            276
          ],
          "status": null
        }
      ]
    },
    {
      "source": "confusion-secondary-dynamicpunch-success-p2.txt",
      "normalized": [
        {
          "species": "persian",
          "level": 100,
          "gender": "M",
          "ability": "limber",
          "item": "",
          "moves": [
            "splash"
          ],
          "stats": [
            271,
            176,
            156,
            166,
            166,
            266
          ],
          "status": null
        }
      ]
    }
  ],
  "source_choices": [
    [
      "move 1",
      "move 1"
    ]
  ],
  "choices": [
    [
      "move 1",
      "move 1"
    ]
  ],
  "forced_outcomes": [],
  "features": [
    "choice.move",
    "damage.gen3",
    "effect.secondary",
    "hit.accuracy",
    "prng.labeled",
    "prng.secondary",
    "state.canonical",
    "volatile.confusion"
  ],
  "boundaries": [
    "request",
    "choice",
    "queue",
    "handlers",
    "immunity",
    "state",
    "events",
    "prng"
  ],
  "limits": {
    "max_boundaries": 2,
    "max_actions": 2
  }
}
